{
  "schemaVersion": 1,
  "id": "entry_01HZX8K3Q9WX",
  "siteId": "site_01HZX8K3Q9EF",
  "collection": "posts",
  "slug": "first-agent-written-article",
  "locale": "en",
  "status": "review",
  "title": "The first agent-written article",
  "summary": "How the newsroom agent researched and drafted this piece.",
  "body": {
    "format": "markdown",
    "value": "# Hello\n\nBody text."
  },
  "fields": {
    "readingMinutes": 4,
    "category": "product",
    "featured": true
  },
  "tags": ["agents", "launch"],
  "author": {
    "kind": "agent",
    "id": "agent_01HZX8K3Q9YZ",
    "name": "Newsroom Agent"
  },
  "coverImage": {
    "src": "/assets/cover.jpg",
    "alt": "Cover"
  },
  "rev": 2,
  "createdAt": "2026-10-07T20:00:00Z",
  "updatedAt": "2026-10-07T21:00:00Z",
  "corrections": [
    {
      "id": "crx_a1b2c3d4",
      "kind": "correction",
      "at": "2026-10-16T08:00:00Z",
      "note": "An earlier version gave the wrong year for the dome's completion; it was **537**.",
      "snapshotId": "snap_a1b2c3d4"
    },
    {
      "id": "crx_e5f6g7h8",
      "kind": "clarification",
      "at": "2026-10-17T10:30:00Z",
      "note": "The museum reopened as a mosque in 2020."
    }
  ]
}
